Title,First Name,E-mail Address,Business Street,Company
LETALSKI CENTER CERKLJE OB KRKI,LETALSKI CENTER CERKLJE OB KRKI,,"Cesta prvih borcev 18, 8250 Brežice",", LETALSKI CENTER CERKLJE OB KRKI"
Javni gospodarski zavod Protokolarne storitve Republike Slovenije,Javni gospodarski zavod Protokolarne storitve Republike Slovenije,,"Predoslje 39, 4000 Kranj",", Javni gospodarski zavod Protokolarne storitve Republike Slovenije"
ZAVOD REPUBLIKE SLOVENIJE ZA BLAGOVNE REZERVE,ZAVOD REPUBLIKE SLOVENIJE ZA BLAGOVNE REZERVE,,"Dunajska cesta 106, 1000 Ljubljana",", ZAVOD REPUBLIKE SLOVENIJE ZA BLAGOVNE REZERVE"
"JAVNI GOSPODARSKI ZAVOD ""POHORJE"" MIRNA, proizvodnja opreme za protipožarno zaščito in namakanje, ulivanje in kovanje barvnih kovin ter kmetijska proizvodnja - v likvidaciji","JAVNI GOSPODARSKI ZAVOD ""POHORJE"" MIRNA, proizvodnja opreme za protipožarno zaščito in namakanje, ulivanje in kovanje barvnih kovin ter kmetijska proizvodnja - v likvidaciji",,"Slovenska vas 14, 8232 Šentrupert",", JAVNI GOSPODARSKI ZAVOD ""POHORJE"" MIRNA, proizvodnja opreme za protipožarno zaščito in namakanje, ulivanje in kovanje barvnih kovin ter kmetijska proizvodnja - v likvidaciji"
"ARAO - Agencija za radioaktivne odpadke, Ljubljana Prevod firme: ARAO - Agency for Radwaste Management, Ljubljana","ARAO - Agencija za radioaktivne odpadke, Ljubljana Prevod firme: ARAO - Agency for Radwaste Management, Ljubljana",,"Celovška cesta 182, 1000 Ljubljana",", ARAO - Agencija za radioaktivne odpadke, Ljubljana Prevod firme: ARAO - Agency for Radwaste Management, Ljubljana"
Javni gospodarski zavod Rinka,Javni gospodarski zavod Rinka,,"Linhartova ulica 3, 3000 Celje",", Javni gospodarski zavod Rinka"
