Ime,Prikazano ime,Glavna e-pošta:,Naslov v službi,Organizacija
SAVINJSKO-ŠALEŠKA OBMOČNA RAZVOJNA AGENCIJA d.o.o.,SAVINJSKO-ŠALEŠKA OBMOČNA RAZVOJNA AGENCIJA d.o.o.,,"Savinjska cesta 2, 3331 Nazarje",", SAVINJSKO-ŠALEŠKA OBMOČNA RAZVOJNA AGENCIJA d.o.o."
JAVNO PODJETJE ZA GOSPODARJENJE S STAVBNIMI ZEMLJIŠČI d.o.o.,JAVNO PODJETJE ZA GOSPODARJENJE S STAVBNIMI ZEMLJIŠČI d.o.o.,,"Grajska ulica 7, 2000 Maribor",", JAVNO PODJETJE ZA GOSPODARJENJE S STAVBNIMI ZEMLJIŠČI d.o.o."
PUNGRAD javno komunalno podjetje d.o.o.,PUNGRAD javno komunalno podjetje d.o.o.,,"Bodonci 127 A, 9265 Bodonci",", PUNGRAD javno komunalno podjetje d.o.o."
INFRASTRUKTURA BLED d.o.o.,INFRASTRUKTURA BLED d.o.o.,,"Rečiška cesta 2, 4260 Bled",", INFRASTRUKTURA BLED d.o.o."
KOMUNALA MEŽICA javno komunalno podjetje d.o.o.,KOMUNALA MEŽICA javno komunalno podjetje d.o.o.,,"Trg svobode 1, 2392 Mežica",", KOMUNALA MEŽICA javno komunalno podjetje d.o.o."
VODOVODI IN KANALIZACIJA NOVA GORICA d.d.,VODOVODI IN KANALIZACIJA NOVA GORICA d.d.,,"Cesta 25. junija 1 B, 5000 Nova Gorica",", VODOVODI IN KANALIZACIJA NOVA GORICA d.d."
"KOMUNA, javno komunalno podjetje Beltinci d.o.o.","KOMUNA, javno komunalno podjetje Beltinci d.o.o.",,"Mladinska ulica 2, 9231 Beltinci",", KOMUNA, javno komunalno podjetje Beltinci d.o.o."
"MESTNE STORITVE, Javno podjetje za urejanje mesta, d.o.o., Nova Gorica","MESTNE STORITVE, Javno podjetje za urejanje mesta, d.o.o., Nova Gorica",,"Trg Edvarda Kardelja 1, 5000 Nova Gorica",", MESTNE STORITVE, Javno podjetje za urejanje mesta, d.o.o., Nova Gorica"
VODOVOD MURSKA SOBOTA javno podjetje d.o.o.,VODOVOD MURSKA SOBOTA javno podjetje d.o.o.,,"Kopališka ulica 2, 9000 Murska Sobota",", VODOVOD MURSKA SOBOTA javno podjetje d.o.o."
"JAVNO PODJETJE EDŠ - Ekološka družba, d.o.o. Šentjernej","JAVNO PODJETJE EDŠ - Ekološka družba, d.o.o. Šentjernej",,"Trubarjeva cesta 5, 8310 Šentjernej",", JAVNO PODJETJE EDŠ - Ekološka družba, d.o.o. Šentjernej"
"PUP - SAUBERMACHER, podjetje za ravnanje z odpadki d.o.o.","PUP - SAUBERMACHER, podjetje za ravnanje z odpadki d.o.o.",,"Koroška cesta 46, 3320 Velenje",", PUP - SAUBERMACHER, podjetje za ravnanje z odpadki d.o.o."
"KONTROLA ZRAČNEGA PROMETA SLOVENIJE, d.o.o.","KONTROLA ZRAČNEGA PROMETA SLOVENIJE, d.o.o.",,"Zgornji Brnik 130 N, 4210 Brnik - Aerodrom",", KONTROLA ZRAČNEGA PROMETA SLOVENIJE, d.o.o."
"EKO-PARK d.o.o. Lendava, javno podjetje OKO-PARK Kft. Lendva, kozhasznu vallalat","EKO-PARK d.o.o. Lendava, javno podjetje OKO-PARK Kft. Lendva, kozhasznu vallalat",,"Glavna ulica 109, 9220 Lendava - Lendva",", EKO-PARK d.o.o. Lendava, javno podjetje OKO-PARK Kft. Lendva, kozhasznu vallalat"
JAVNO KOMUNALNO PODJETJE ŠALOVCI d.o.o.,JAVNO KOMUNALNO PODJETJE ŠALOVCI d.o.o.,,"Šalovci 162, 9204 Šalovci",", JAVNO KOMUNALNO PODJETJE ŠALOVCI d.o.o."
"CENTER ZA RAVNANJE Z ODPADKI ZASAVJE, d.o.o.","CENTER ZA RAVNANJE Z ODPADKI ZASAVJE, d.o.o.",,"Brdce 41 B, 1431 Dol pri Hrastniku",", CENTER ZA RAVNANJE Z ODPADKI ZASAVJE, d.o.o."
"JAVNO PODJETJE KOMUNALA VODICE, d.o.o.","JAVNO PODJETJE KOMUNALA VODICE, d.o.o.",,"Kopitarjev trg 1, 1217 Vodice",", JAVNO PODJETJE KOMUNALA VODICE, d.o.o."
"CEROD, center za ravnanje z odpadki, d.o.o., javno podjetje","CEROD, center za ravnanje z odpadki, d.o.o., javno podjetje",,"Kettejev drevored 3, 8000 Novo mesto",", CEROD, center za ravnanje z odpadki, d.o.o., javno podjetje"
Javno podjetje center za ravnanje z odpadki Puconci d.o.o.,Javno podjetje center za ravnanje z odpadki Puconci d.o.o.,,"Vaneča 81 B, 9201 Puconci",", Javno podjetje center za ravnanje z odpadki Puconci d.o.o."
"Javne službe Ptuj, podjetje za izvajanje gospodarskih javnih služb in drugih dejavnosti, d.o.o.","Javne službe Ptuj, podjetje za izvajanje gospodarskih javnih služb in drugih dejavnosti, d.o.o.",,"Ulica heroja Lacka 3, 2250 Ptuj",", Javne službe Ptuj, podjetje za izvajanje gospodarskih javnih služb in drugih dejavnosti, d.o.o."
Javno podjetje Prlekija d.o.o.,Javno podjetje Prlekija d.o.o.,,"Babinska cesta 2 A, 9240 Ljutomer",", Javno podjetje Prlekija d.o.o."
"RASR, Razvojna agencija savinjske regije, d.o.o.","RASR, Razvojna agencija savinjske regije, d.o.o.",,"Ulica XIV. divizije 12, 3000 Celje",", RASR, Razvojna agencija savinjske regije, d.o.o."
VARAŠ družba za komunalne storitve d.o.o.,VARAŠ družba za komunalne storitve d.o.o.,,"Ulica Štefana Kovača 73, 9224 Turnišče",", VARAŠ družba za komunalne storitve d.o.o."
"VZDRŽEVANJE IN GRADNJE KIDRIČEVO, javno podjetje, d.o.o.","VZDRŽEVANJE IN GRADNJE KIDRIČEVO, javno podjetje, d.o.o.",,"Kopališka ulica 14, 2325 Kidričevo",", VZDRŽEVANJE IN GRADNJE KIDRIČEVO, javno podjetje, d.o.o."
"Javno podjetje za mestni potniški promet Marprom, d.o.o.","Javno podjetje za mestni potniški promet Marprom, d.o.o.",,"Mlinska ulica 1, 2000 Maribor",", Javno podjetje za mestni potniški promet Marprom, d.o.o."
"JAVNO PODJETJE KOVOD POSTOJNA, vodovod, kanalizacija, d.o.o., Postojna","JAVNO PODJETJE KOVOD POSTOJNA, vodovod, kanalizacija, d.o.o., Postojna",,"Jeršice 3, 6230 Postojna",", JAVNO PODJETJE KOVOD POSTOJNA, vodovod, kanalizacija, d.o.o., Postojna"
SNAGA Javno podjetje d.o.o.,SNAGA Javno podjetje d.o.o.,,"Povšetova ulica 6, 1000 Ljubljana",", SNAGA Javno podjetje d.o.o."
"ŽALE Javno podjetje, d.o.o.","ŽALE Javno podjetje, d.o.o.",,"Med hmeljniki 2, 1000 Ljubljana",", ŽALE Javno podjetje, d.o.o."
"Javno podjetje Komunalno podjetje Vrhnika, d.o.o.","Javno podjetje Komunalno podjetje Vrhnika, d.o.o.",,"Pot na Tojnice 40, 1360 Vrhnika",", Javno podjetje Komunalno podjetje Vrhnika, d.o.o."
JAVNO PODJETJE KOMUNALA TRBOVLJE d.o.o.,JAVNO PODJETJE KOMUNALA TRBOVLJE d.o.o.,,"Savinjska cesta 11 A, 1420 Trbovlje",", JAVNO PODJETJE KOMUNALA TRBOVLJE d.o.o."
"JAVNO PODJETJE KOMUNALA ILIRSKA BISTRICA, d.o.o.","JAVNO PODJETJE KOMUNALA ILIRSKA BISTRICA, d.o.o.",,"Prešernova ulica 7, 6250 Ilirska Bistrica",", JAVNO PODJETJE KOMUNALA ILIRSKA BISTRICA, d.o.o."
JAVNO PODJETJE VODOVOD-KANALIZACIJA d.o.o.,JAVNO PODJETJE VODOVOD-KANALIZACIJA d.o.o.,,"Vodovodna cesta 90, 1000 Ljubljana",", JAVNO PODJETJE VODOVOD-KANALIZACIJA d.o.o."
JAVNO PODJETJE KOMUNALA ČRNOMELJ d.o.o.,JAVNO PODJETJE KOMUNALA ČRNOMELJ d.o.o.,,"Belokranjska cesta 24 A, 8340 Črnomelj",", JAVNO PODJETJE KOMUNALA ČRNOMELJ d.o.o."
"KOMUNALA RADOVLJICA, javno podjetje za komunalno dejavnost, d.o.o.","KOMUNALA RADOVLJICA, javno podjetje za komunalno dejavnost, d.o.o.",,"Ljubljanska cesta 27, 4240 Radovljica",", KOMUNALA RADOVLJICA, javno podjetje za komunalno dejavnost, d.o.o."
"NIGRAD, komunalno podjetje, d.d.","NIGRAD, komunalno podjetje, d.d.",,"Zagrebška cesta 30, 2000 Maribor",", NIGRAD, komunalno podjetje, d.d."
"KOMUNALA KRANJ, javno podjetje, d.o.o.","KOMUNALA KRANJ, javno podjetje, d.o.o.",,"Ulica Mirka Vadnova 1, 4000 Kranj",", KOMUNALA KRANJ, javno podjetje, d.o.o."
JAVNO PODJETJE KOMUNALA CERKNICA d.o.o. Cerknica,JAVNO PODJETJE KOMUNALA CERKNICA d.o.o. Cerknica,,"Notranjska cesta 44, 1380 Cerknica",", JAVNO PODJETJE KOMUNALA CERKNICA d.o.o. Cerknica"
JAVNO PODJETJE - AZIENDA PUBLICA RIŽANSKI VODOVOD KOPER d.o.o. - s.r.l.,JAVNO PODJETJE - AZIENDA PUBLICA RIŽANSKI VODOVOD KOPER d.o.o. - s.r.l.,,"Ulica 15.maja 13, 6000 Koper - Capodistria",", JAVNO PODJETJE - AZIENDA PUBLICA RIŽANSKI VODOVOD KOPER d.o.o. - s.r.l."
JAVNO KOMUNALNO PODJETJE KOMUNALA KOČEVJE d.o.o.,JAVNO KOMUNALNO PODJETJE KOMUNALA KOČEVJE d.o.o.,,"Tesarska ulica 10, 1330 Kočevje",", JAVNO KOMUNALNO PODJETJE KOMUNALA KOČEVJE d.o.o."
"SNAGA, družba za ravnanje z odpadki in druge komunalne storitve, d.o.o.","SNAGA, družba za ravnanje z odpadki in druge komunalne storitve, d.o.o.",,"Nasipna ulica 64, 2000 Maribor",", SNAGA, družba za ravnanje z odpadki in druge komunalne storitve, d.o.o."
MARIBORSKI VODOVOD javno podjetje d.d.,MARIBORSKI VODOVOD javno podjetje d.d.,,"Jadranska cesta 24, 2000 Maribor",", MARIBORSKI VODOVOD javno podjetje d.d."
"KOMUNALA, javno podjetje d.o.o.","KOMUNALA, javno podjetje d.o.o.",,"Kopališka ulica 2, 9000 Murska Sobota",", KOMUNALA, javno podjetje d.o.o."
JAVNO KOMUNALNO PODJETJE RADLJE OB DRAVI d.o.o.,JAVNO KOMUNALNO PODJETJE RADLJE OB DRAVI d.o.o.,,"Mariborska cesta 3, 2360 Radlje ob Dravi",", JAVNO KOMUNALNO PODJETJE RADLJE OB DRAVI d.o.o."
JAVNO KOMUNALNO PODJETJE KOMUNALA RIBNICA d.o.o.,JAVNO KOMUNALNO PODJETJE KOMUNALA RIBNICA d.o.o.,,"Goriča vas 11 A, 1310 Ribnica",", JAVNO KOMUNALNO PODJETJE KOMUNALA RIBNICA d.o.o."
JAVNO PODJETJE KOMUNALA d.o.o. Sevnica,JAVNO PODJETJE KOMUNALA d.o.o. Sevnica,,"Naselje heroja Maroka 17, 8290 Sevnica",", JAVNO PODJETJE KOMUNALA d.o.o. Sevnica"
"JKP, JAVNO KOMUNALNO PODJETJE d.o.o. SLOVENSKE KONJICE","JKP, JAVNO KOMUNALNO PODJETJE d.o.o. SLOVENSKE KONJICE",,"Celjska cesta 3, 3210 Slovenske Konjice",", JKP, JAVNO KOMUNALNO PODJETJE d.o.o. SLOVENSKE KONJICE"
"JAVNO KOMUNALNO PODJETJE ŽALEC, d.o.o.","JAVNO KOMUNALNO PODJETJE ŽALEC, d.o.o.",,"Ulica Nade Cilenšek 5, 3310 Žalec",", JAVNO KOMUNALNO PODJETJE ŽALEC, d.o.o."
"Javno podjetje–Azienda pubblica MARJETICA KOPER, d.o.o.-s.r.l.","Javno podjetje–Azienda pubblica MARJETICA KOPER, d.o.o.-s.r.l.",,"Ulica 15.maja 4, 6000 Koper - Capodistria",", Javno podjetje–Azienda pubblica MARJETICA KOPER, d.o.o.-s.r.l."
Javno podjetje KRAŠKI VODOVOD SEŽANA d.o.o.,Javno podjetje KRAŠKI VODOVOD SEŽANA d.o.o.,,"Bazoviška cesta 6, 6210 Sežana",", Javno podjetje KRAŠKI VODOVOD SEŽANA d.o.o."
"JAVNO PODJETJE KOMUNALA ZAGORJE, d.o.o.","JAVNO PODJETJE KOMUNALA ZAGORJE, d.o.o.",,"Cesta zmage 57, 1410 Zagorje ob Savi",", JAVNO PODJETJE KOMUNALA ZAGORJE, d.o.o."
"KOMUNALA NOVO MESTO d.o.o., javno podjetje","KOMUNALA NOVO MESTO d.o.o., javno podjetje",,"Podbevškova ulica 12, 8000 Novo mesto",", KOMUNALA NOVO MESTO d.o.o., javno podjetje"
KOMUNALA SLOVENSKA BISTRICA podjetje za komunalne in druge storitve d.o.o.,KOMUNALA SLOVENSKA BISTRICA podjetje za komunalne in druge storitve d.o.o.,,"Ulica Pohorskega bataljona 12, 2310 Slovenska Bistrica",", KOMUNALA SLOVENSKA BISTRICA podjetje za komunalne in druge storitve d.o.o."
"HYDROVOD d.o.o., družba za komunalno dejavnost","HYDROVOD d.o.o., družba za komunalno dejavnost",,"Ljubljanska cesta 38, 1330 Kočevje",", HYDROVOD d.o.o., družba za komunalno dejavnost"
"Komunala Tolmin, javno podjetje, d.o.o.","Komunala Tolmin, javno podjetje, d.o.o.",,"Poljubinj 89 H, 5220 Tolmin",", Komunala Tolmin, javno podjetje, d.o.o."
JAVNO KOMUNALNO PODJETJE LOG d.o.o.,JAVNO KOMUNALNO PODJETJE LOG d.o.o.,,"Dobja vas 187, 2390 Ravne na Koroškem",", JAVNO KOMUNALNO PODJETJE LOG d.o.o."
Javno podjetje Energetika Maribor d.o.o.,Javno podjetje Energetika Maribor d.o.o.,,"Jadranska cesta 28, 2000 Maribor",", Javno podjetje Energetika Maribor d.o.o."
"OKP JAVNO PODJETJE ZA KOMUNALNE STORITVE Rogaška Slatina, d.o.o.","OKP JAVNO PODJETJE ZA KOMUNALNE STORITVE Rogaška Slatina, d.o.o.",,"Celjska cesta 12, 3250 Rogaška Slatina",", OKP JAVNO PODJETJE ZA KOMUNALNE STORITVE Rogaška Slatina, d.o.o."
"JAVNO PODJETJE KOMUNALNO STANOVANJSKO PODJETJE Litija, d.o.o.","JAVNO PODJETJE KOMUNALNO STANOVANJSKO PODJETJE Litija, d.o.o.",,"Ponoviška cesta 15, 1270 Litija",", JAVNO PODJETJE KOMUNALNO STANOVANJSKO PODJETJE Litija, d.o.o."
JAVNO KOMUNALNO PODJETJE GROSUPLJE d.o.o.,JAVNO KOMUNALNO PODJETJE GROSUPLJE d.o.o.,,"Cesta na Krko 7, 1290 Grosuplje",", JAVNO KOMUNALNO PODJETJE GROSUPLJE d.o.o."
Javno podjetje KOMUNALA Idrija d.o.o.,Javno podjetje KOMUNALA Idrija d.o.o.,,"Carl Jakoba ulica 4, 5280 Idrija",", Javno podjetje KOMUNALA Idrija d.o.o."
"JAVNO PODJETJE KOMUNALA Izola, d.o.o. Azienda pubblica KOMUNALA Isola, S.r.l.","JAVNO PODJETJE KOMUNALA Izola, d.o.o. Azienda pubblica KOMUNALA Isola, S.r.l.",,"Industrijska cesta 8, 6310 Izola - Isola",", JAVNO PODJETJE KOMUNALA Izola, d.o.o. Azienda pubblica KOMUNALA Isola, S.r.l."
KOMUNALA METLIKA javno podjetje d.o.o.,KOMUNALA METLIKA javno podjetje d.o.o.,,"Cesta XV. brigade 4, 8330 Metlika",", KOMUNALA METLIKA javno podjetje d.o.o."
"RUDNIK ŽIROVSKI VRH, javno podjetje za zapiranje rudnika urana, d.o.o.","RUDNIK ŽIROVSKI VRH, javno podjetje za zapiranje rudnika urana, d.o.o.",,"Todraž 1, 4224 Gorenja vas",", RUDNIK ŽIROVSKI VRH, javno podjetje za zapiranje rudnika urana, d.o.o."
KOMUNALNO STANOVANJSKA DRUŽBA d.o.o. Ajdovščina,KOMUNALNO STANOVANJSKA DRUŽBA d.o.o. Ajdovščina,,"Goriška cesta 23 B, 5270 Ajdovščina",", KOMUNALNO STANOVANJSKA DRUŽBA d.o.o. Ajdovščina"
JAVNO KOMUNALNO PODJETJE DRAVOGRAD d.o.o.,JAVNO KOMUNALNO PODJETJE DRAVOGRAD d.o.o.,,"Meža 143, 2370 Dravograd",", JAVNO KOMUNALNO PODJETJE DRAVOGRAD d.o.o."
"JAVNO PODJETJE KOMUNALA, d.o.o. Mozirje","JAVNO PODJETJE KOMUNALA, d.o.o. Mozirje",,"Praprotnikova ulica 36, 3330 Mozirje",", JAVNO PODJETJE KOMUNALA, d.o.o. Mozirje"
"KOMUNALNO PODJETJE VELENJE Izvajanje komunalnih dejavnosti, d.o.o","KOMUNALNO PODJETJE VELENJE Izvajanje komunalnih dejavnosti, d.o.o",,"Koroška cesta 37 B, 3320 Velenje",", KOMUNALNO PODJETJE VELENJE Izvajanje komunalnih dejavnosti, d.o.o"
"JAVNO PODJETJE LJUBLJANSKI POTNIŠKI PROMET, d.o.o.","JAVNO PODJETJE LJUBLJANSKI POTNIŠKI PROMET, d.o.o.",,"Celovška cesta 160, 1000 Ljubljana",", JAVNO PODJETJE LJUBLJANSKI POTNIŠKI PROMET, d.o.o."
JAVNO PODJETJE ENERGETIKA LJUBLJANA d.o.o.,JAVNO PODJETJE ENERGETIKA LJUBLJANA d.o.o.,,"Verovškova ulica 62, 1000 Ljubljana",", JAVNO PODJETJE ENERGETIKA LJUBLJANA d.o.o."
JAVNO KOMUNALNO PODJETJE PRODNIK d.o.o.,JAVNO KOMUNALNO PODJETJE PRODNIK d.o.o.,,"Savska cesta 34, 1230 Domžale",", JAVNO KOMUNALNO PODJETJE PRODNIK d.o.o."
JAVNO PODJETJE CENTRALNA ČISTILNA NAPRAVA DOMŽALE - KAMNIK d.o.o.,JAVNO PODJETJE CENTRALNA ČISTILNA NAPRAVA DOMŽALE - KAMNIK d.o.o.,,"Študljanska cesta 91, 1230 Domžale",", JAVNO PODJETJE CENTRALNA ČISTILNA NAPRAVA DOMŽALE - KAMNIK d.o.o."
JAVNO PODJETJE KOMUNALNA ENERGETIKA Nova Gorica d.o.o.,JAVNO PODJETJE KOMUNALNA ENERGETIKA Nova Gorica d.o.o.,,"Sedejeva ulica 7, 5000 Nova Gorica",", JAVNO PODJETJE KOMUNALNA ENERGETIKA Nova Gorica d.o.o."
KOMUNALA TREBNJE d.o.o.,KOMUNALA TREBNJE d.o.o.,,"Goliev trg 9, 8210 Trebnje",", KOMUNALA TREBNJE d.o.o."
JAVNO PODJETJE KOMUNALA RADEČE d.o.o.,JAVNO PODJETJE KOMUNALA RADEČE d.o.o.,,"Titova ulica 107, 1433 Radeče",", JAVNO PODJETJE KOMUNALA RADEČE d.o.o."
SAUBERMACHER - KOMUNALA - podjetje za odstranjevanje odpadkov Murska Sobota d.o.o.,SAUBERMACHER - KOMUNALA - podjetje za odstranjevanje odpadkov Murska Sobota d.o.o.,,"Noršinska ulica 12, 9000 Murska Sobota",", SAUBERMACHER - KOMUNALA - podjetje za odstranjevanje odpadkov Murska Sobota d.o.o."
"ARAO - Agencija za radioaktivne odpadke, Ljubljana Prevod firme: ARAO - Agency for Radwaste Management, Ljubljana","ARAO - Agencija za radioaktivne odpadke, Ljubljana Prevod firme: ARAO - Agency for Radwaste Management, Ljubljana",,"Celovška cesta 182, 1000 Ljubljana",", ARAO - Agencija za radioaktivne odpadke, Ljubljana Prevod firme: ARAO - Agency for Radwaste Management, Ljubljana"
"Javno podjetje Ljubljanska parkirišča in tržnice, d.o.o.","Javno podjetje Ljubljanska parkirišča in tržnice, d.o.o.",,"Kopitarjeva ulica 2, 1000 Ljubljana",", Javno podjetje Ljubljanska parkirišča in tržnice, d.o.o."
"KOMUNALA VITANJE, javno podjetje d.o.o.,","KOMUNALA VITANJE, javno podjetje d.o.o.,",,"Grajski trg 6, 3205 Vitanje",", KOMUNALA VITANJE, javno podjetje d.o.o.,"
JAVNO PODJETJE PLINOVOD SEVNICA,JAVNO PODJETJE PLINOVOD SEVNICA,,"Trg svobode 9, 8290 Sevnica",", JAVNO PODJETJE PLINOVOD SEVNICA"
"Javno podjetje Komunalno podjetje Logatec, d.o.o.","Javno podjetje Komunalno podjetje Logatec, d.o.o.",,"Tržaška cesta 27, 1370 Logatec",", Javno podjetje Komunalno podjetje Logatec, d.o.o."
"JAVNI HOLDING LJUBLJANA, d.o.o., družba za izvajanje strokovnih in razvojnih nalog na področju gospodarskih javnih služb","JAVNI HOLDING LJUBLJANA, d.o.o., družba za izvajanje strokovnih in razvojnih nalog na področju gospodarskih javnih služb",,"Verovškova ulica 70, 1000 Ljubljana",", JAVNI HOLDING LJUBLJANA, d.o.o., družba za izvajanje strokovnih in razvojnih nalog na področju gospodarskih javnih služb"
"SIMBIO, družba za ravnanje z odpadki d.o.o.","SIMBIO, družba za ravnanje z odpadki d.o.o.",,"Teharska cesta 49, 3000 Celje",", SIMBIO, družba za ravnanje z odpadki d.o.o."
"ENERGETIKA CELJE javno podjetje, d.o.o.","ENERGETIKA CELJE javno podjetje, d.o.o.",,"Smrekarjeva ulica 1, 3000 Celje",", ENERGETIKA CELJE javno podjetje, d.o.o."
"VODOVOD - KANALIZACIJA javno podjetje, d.o.o.","VODOVOD - KANALIZACIJA javno podjetje, d.o.o.",,"Lava 2 A, 3000 Celje",", VODOVOD - KANALIZACIJA javno podjetje, d.o.o."
"JEKO - IN, javno komunalno podjetje, d.o.o., Jesenice","JEKO - IN, javno komunalno podjetje, d.o.o., Jesenice",,"Cesta maršala Tita 51, 4270 Jesenice",", JEKO - IN, javno komunalno podjetje, d.o.o., Jesenice"
JAVNO KOMUNALNO PODJETJE BREZOVICA d.o.o.,JAVNO KOMUNALNO PODJETJE BREZOVICA d.o.o.,,"Kamnik pod Krimom 6, 1352 Preserje",", JAVNO KOMUNALNO PODJETJE BREZOVICA d.o.o."
Javno podjetje Komunala Brežice d.o.o.,Javno podjetje Komunala Brežice d.o.o.,,"Cesta prvih borcev 18, 8250 Brežice",", Javno podjetje Komunala Brežice d.o.o."
"KOCEROD, družba za ravnanje z odpadki d.o.o.","KOCEROD, družba za ravnanje z odpadki d.o.o.",,"Mislinjska Dobrava 108 A, 2383 Šmartno pri Slovenj Gradcu",", KOCEROD, družba za ravnanje z odpadki d.o.o."
Javno podjetje VODOVOD SISTEMA B d.o.o.,Javno podjetje VODOVOD SISTEMA B d.o.o.,,"Kopališka ulica 2, 9000 Murska Sobota",", Javno podjetje VODOVOD SISTEMA B d.o.o."
